{
  "auth_realm": null,
  "bytes": 592,
  "etag": null,
  "fetched_at": "2026-06-26T00:00:00Z",
  "last_modified": null,
  "schema": "earthsciio/manifest/v1",
  "sha256_content": "987afbde33325d81bac3aadd615764559f214d688fc3ce028f6030ce73751385",
  "source_loader": "geosfp",
  "url": "https://data.earthsci.dev/prefetch/geosfp-2hourly.20240101_0600.nc"
}
